"country","countryCode","date","filterByKeyword","filterByRating","input","isAmazonVine","isVerified","position","product/listPrice","product/price","productAsin","productOriginalAsin","ratingScore","reviewCategoryUrl","reviewDescription","reviewId","reviewImages/0","reviewImages/1","reviewImages/2","reviewImages/3","reviewImages/4","reviewImages/5","reviewImages/6","reviewReaction","reviewTitle","reviewUrl","reviewedIn","totalCategoryRatings","totalCategoryReviews","userId","userProfileLink","variant","variantAsin","variantAttributes/0/key","variantAttributes/0/value","variantAttributes/1/key","variantAttributes/1/value","variantAttributes/2/key","variantAttributes/2/value","variantAttributes/3/key","variantAttributes/3/value"
"United States",,"2024-02-21",,"oneStar","https://www.amazon.com/Apple-iPhone-12-Mini-Black/dp/B08PPDJWC8/ref=sr_1_1?crid=6JEL7PMT16KU&dib=eyJ2IjoiMSJ9.BekHJGSAbG9Dm1eKkWWtBoxrLIAwfJjcfkmOec8VMXmJ5_gn_XCE4Z6cB84ZPqhNpoxs8vHUdTXy5ZJAAy_AuhPOHi79Fw8twlFPwGLCvMz1kK3VYJbRA9YDYHCfDHYLr2bjOGeHDBavT6EBh2LuQUT1HAjs2kRomRsCtMj8xeynLQq9wyKzjHqHzUnbufTY_5ojWllugueaJdvlq9VZHAbmf1eGilBLHZOnc5CrZKE.oJePQPVQKEaDe3aFMr5QiVCoE0pzCHCite0hve0WmlE&dib_tag=se&keywords=*+iPhone+12+mini&qid=1752790341&sprefix=iphone+12+mini%2Caps%2C631&sr=8-1","false","true","92",,,"B08PPDJWC8","B08PPDJWC8","1","https://www.amazon.com/product-reviews/B08PPDJWC8?pageNumber=1&filterByStar=one_star&sortBy=helpful&formatType=all_formats&asin=B08PPDJWC8&reftag=cm_cr_arp_d_paging_btm_next_1&scope=reviewsAjax0","The phone was clearly not refurbished or even tested. The phone arrived and had only been cleared of data but NOT factory reset. Then the ear speaker doesn't work! I can't hear anyone on a phone call. It either has to be set to speaker or I have to use headphones to talk on the phone and hear the other person. I think the basic function of the phone should have been tested before selling it! ETA: I requested a replacement since this one didn't work. Now they are saying they can't send a new one until I send the current one. But I need the current one to set up the new one they claim to be sending me. Amazon says I have until March 25 to return it. The 3rd party says that is inaccurate. I will never buy from amazon or them again. This is a mess.","R256GSDOEVTVF3",,,,,,,,,"Not factory reset and the ear speaker doesn't work!","https://www.amazon.com/gp/customer-reviews/R256GSDOEVTVF3","Reviewed in the United States on February 21, 2024","16635","1348",,,"Size: 256GB, Color: Green, Service Provider: Unlocked, Product grade: Renewed","B08PPDJWC8","Size","256GB","Color","Green","Service Provider","Unlocked","Product grade","Renewed"
"United States",,"2025-04-08",,"oneStar","https://www.amazon.com/Apple-iPhone-12-Mini-Black/dp/B08PPDJWC8/ref=sr_1_1?crid=6JEL7PMT16KU&dib=eyJ2IjoiMSJ9.BekHJGSAbG9Dm1eKkWWtBoxrLIAwfJjcfkmOec8VMXmJ5_gn_XCE4Z6cB84ZPqhNpoxs8vHUdTXy5ZJAAy_AuhPOHi79Fw8twlFPwGLCvMz1kK3VYJbRA9YDYHCfDHYLr2bjOGeHDBavT6EBh2LuQUT1HAjs2kRomRsCtMj8xeynLQq9wyKzjHqHzUnbufTY_5ojWllugueaJdvlq9VZHAbmf1eGilBLHZOnc5CrZKE.oJePQPVQKEaDe3aFMr5QiVCoE0pzCHCite0hve0WmlE&dib_tag=se&keywords=*+iPhone+12+mini&qid=1752790341&sprefix=iphone+12+mini%2Caps%2C631&sr=8-1","false","true","93",,,"B08PPDJWC8","B08PPDJWC8","1","https://www.amazon.com/product-reviews/B08PPDJWC8?pageNumber=1&filterByStar=one_star&sortBy=helpful&formatType=all_formats&asin=B08PPDJWC8&reftag=cm_cr_arp_d_paging_btm_next_1&scope=reviewsAjax0","Phone isn’t an AT&T phone like stated. Took to the AT&T store in Pittsburg Kansas and they confirmed the phone wasn’t part of their network and phone sim was locked. One of the worst sellers on Amazon! Tired to resolve and they refused to do anything but just take the phone back and no refund or help.","RCWOCWSFQCPU8",,,,,,,,,"Poor excuse for a company.","https://www.amazon.com/gp/customer-reviews/RCWOCWSFQCPU8","Reviewed in the United States on April 8, 2025","16635","1348",,,"Size: 64GB, Color: Red, Service Provider: AT&amp;T, Product grade: Renewed","B08PPDJWC8","Size","64GB","Color","Red","Service Provider","AT&amp;T","Product grade","Renewed"
"United States",,"2024-10-08",,"oneStar","https://www.amazon.com/Apple-iPhone-12-Mini-Black/dp/B08PPDJWC8/ref=sr_1_1?crid=6JEL7PMT16KU&dib=eyJ2IjoiMSJ9.BekHJGSAbG9Dm1eKkWWtBoxrLIAwfJjcfkmOec8VMXmJ5_gn_XCE4Z6cB84ZPqhNpoxs8vHUdTXy5ZJAAy_AuhPOHi79Fw8twlFPwGLCvMz1kK3VYJbRA9YDYHCfDHYLr2bjOGeHDBavT6EBh2LuQUT1HAjs2kRomRsCtMj8xeynLQq9wyKzjHqHzUnbufTY_5ojWllugueaJdvlq9VZHAbmf1eGilBLHZOnc5CrZKE.oJePQPVQKEaDe3aFMr5QiVCoE0pzCHCite0hve0WmlE&dib_tag=se&keywords=*+iPhone+12+mini&qid=1752790341&sprefix=iphone+12+mini%2Caps%2C631&sr=8-1","false","true","94",,,"B08PPDJWC8","B08PPDJWC8","1","https://www.amazon.com/product-reviews/B08PPDJWC8?pageNumber=1&filterByStar=one_star&sortBy=helpful&formatType=all_formats&asin=B08PPDJWC8&reftag=cm_cr_arp_d_paging_btm_next_1&scope=reviewsAjax0","The item description was not correct. This phone was supposed to have cosmetic flaws. Instead, the power button wouldn’t depress, there was an error about the display repair that would clear stating their was a problem with the repair, several lines in the screen at random times when it would turn on without being touched and would get stuck and you would have to wait for the phone to die because the power button didn’t work. There was also a large white spot on the screen itself. I have returned the phone but still have received my refund. I would have rather had the description be correct and there have been scratches or cosmetic flaws, not functionality issues. Please provide full refund as I did not receive what I was intended.","R198PF6DRHXQ9I",,,,,,,,,"Not as described- unable to keep due to display not working.","https://www.amazon.com/gp/customer-reviews/R198PF6DRHXQ9I","Reviewed in the United States on October 8, 2024","16635","1348",,,"Size: 64GB, Color: Purple, Service Provider: Unlocked, Product grade: Renewed","B08PPDJWC8","Size","64GB","Color","Purple","Service Provider","Unlocked","Product grade","Renewed"
"United States",,"2025-05-02",,"oneStar","https://www.amazon.com/Apple-iPhone-12-Mini-Black/dp/B08PPDJWC8/ref=sr_1_1?crid=6JEL7PMT16KU&dib=eyJ2IjoiMSJ9.BekHJGSAbG9Dm1eKkWWtBoxrLIAwfJjcfkmOec8VMXmJ5_gn_XCE4Z6cB84ZPqhNpoxs8vHUdTXy5ZJAAy_AuhPOHi79Fw8twlFPwGLCvMz1kK3VYJbRA9YDYHCfDHYLr2bjOGeHDBavT6EBh2LuQUT1HAjs2kRomRsCtMj8xeynLQq9wyKzjHqHzUnbufTY_5ojWllugueaJdvlq9VZHAbmf1eGilBLHZOnc5CrZKE.oJePQPVQKEaDe3aFMr5QiVCoE0pzCHCite0hve0WmlE&dib_tag=se&keywords=*+iPhone+12+mini&qid=1752790341&sprefix=iphone+12+mini%2Caps%2C631&sr=8-1","false","true","95",,,"B08PPDJWC8","B08PPDJWC8","1","https://www.amazon.com/product-reviews/B08PPDJWC8?pageNumber=1&filterByStar=one_star&sortBy=helpful&formatType=all_formats&asin=B08PPDJWC8&reftag=cm_cr_arp_d_paging_btm_next_1&scope=reviewsAjax0","Much smaller than the description reads. It's supposed to be 6.1 inches and it's barely 5.5. The phone won't even turn on. Came much sooner than expected but that's the only good thing I can write about.","R2FES9EH7SDXJH",,,,,,,,,"😩","https://www.amazon.com/gp/customer-reviews/R2FES9EH7SDXJH","Reviewed in the United States on May 2, 2025","16635","1348",,,"Size: 64GB, Color: Blue, Service Provider: Unlocked, Product grade: Renewed Premium","B08PPDJWC8","Size","64GB","Color","Blue","Service Provider","Unlocked","Product grade","Renewed Premium"
"United States",,"2025-06-01",,"oneStar","https://www.amazon.com/Apple-iPhone-12-Mini-Black/dp/B08PPDJWC8/ref=sr_1_1?crid=6JEL7PMT16KU&dib=eyJ2IjoiMSJ9.BekHJGSAbG9Dm1eKkWWtBoxrLIAwfJjcfkmOec8VMXmJ5_gn_XCE4Z6cB84ZPqhNpoxs8vHUdTXy5ZJAAy_AuhPOHi79Fw8twlFPwGLCvMz1kK3VYJbRA9YDYHCfDHYLr2bjOGeHDBavT6EBh2LuQUT1HAjs2kRomRsCtMj8xeynLQq9wyKzjHqHzUnbufTY_5ojWllugueaJdvlq9VZHAbmf1eGilBLHZOnc5CrZKE.oJePQPVQKEaDe3aFMr5QiVCoE0pzCHCite0hve0WmlE&dib_tag=se&keywords=*+iPhone+12+mini&qid=1752790341&sprefix=iphone+12+mini%2Caps%2C631&sr=8-1","false","true","96",,,"B08PPDJWC8","B08PPDJWC8","1","https://www.amazon.com/product-reviews/B08PPDJWC8?pageNumber=1&filterByStar=one_star&sortBy=helpful&formatType=all_formats&asin=B08PPDJWC8&reftag=cm_cr_arp_d_paging_btm_next_1&scope=reviewsAjax0","Should’ve know it was too good to be true. Received the phone and not able to hear any sound. The return process is a bit much.","R2NERUE91QX2AJ",,,,,,,,,"Defective device","https://www.amazon.com/gp/customer-reviews/R2NERUE91QX2AJ","Reviewed in the United States on June 1, 2025","16635","1348",,,"Size: 64GB, Color: Black, Service Provider: Unlocked, Product grade: Renewed","B08PPDJWC8","Size","64GB","Color","Black","Service Provider","Unlocked","Product grade","Renewed"
"United States",,"2025-06-02",,"oneStar","https://www.amazon.com/Apple-iPhone-12-Mini-Black/dp/B08PPDJWC8/ref=sr_1_1?crid=6JEL7PMT16KU&dib=eyJ2IjoiMSJ9.BekHJGSAbG9Dm1eKkWWtBoxrLIAwfJjcfkmOec8VMXmJ5_gn_XCE4Z6cB84ZPqhNpoxs8vHUdTXy5ZJAAy_AuhPOHi79Fw8twlFPwGLCvMz1kK3VYJbRA9YDYHCfDHYLr2bjOGeHDBavT6EBh2LuQUT1HAjs2kRomRsCtMj8xeynLQq9wyKzjHqHzUnbufTY_5ojWllugueaJdvlq9VZHAbmf1eGilBLHZOnc5CrZKE.oJePQPVQKEaDe3aFMr5QiVCoE0pzCHCite0hve0WmlE&dib_tag=se&keywords=*+iPhone+12+mini&qid=1752790341&sprefix=iphone+12+mini%2Caps%2C631&sr=8-1","false","true","97",,,"B08PPDJWC8","B08PPDJWC8","1","https://www.amazon.com/product-reviews/B08PPDJWC8?pageNumber=1&filterByStar=one_star&sortBy=helpful&formatType=all_formats&asin=B08PPDJWC8&reftag=cm_cr_arp_d_paging_btm_next_1&scope=reviewsAjax0","This phone is smaller than what is show on the site and the information regarding the size is incorrect very dissatisfied Would want a refund","RK47MDPCSYV4E",,,,,,,,,"Dissatisfied customer","https://www.amazon.com/gp/customer-reviews/RK47MDPCSYV4E","Reviewed in the United States on June 2, 2025","16635","1348",,,"Size: 128GB, Color: Blue, Service Provider: Unlocked, Product grade: Renewed","B08PPDJWC8","Size","128GB","Color","Blue","Service Provider","Unlocked","Product grade","Renewed"
"United States",,"2025-05-10",,"oneStar","https://www.amazon.com/Apple-iPhone-12-Mini-Black/dp/B08PPDJWC8/ref=sr_1_1?crid=6JEL7PMT16KU&dib=eyJ2IjoiMSJ9.BekHJGSAbG9Dm1eKkWWtBoxrLIAwfJjcfkmOec8VMXmJ5_gn_XCE4Z6cB84ZPqhNpoxs8vHUdTXy5ZJAAy_AuhPOHi79Fw8twlFPwGLCvMz1kK3VYJbRA9YDYHCfDHYLr2bjOGeHDBavT6EBh2LuQUT1HAjs2kRomRsCtMj8xeynLQq9wyKzjHqHzUnbufTY_5ojWllugueaJdvlq9VZHAbmf1eGilBLHZOnc5CrZKE.oJePQPVQKEaDe3aFMr5QiVCoE0pzCHCite0hve0WmlE&dib_tag=se&keywords=*+iPhone+12+mini&qid=1752790341&sprefix=iphone+12+mini%2Caps%2C631&sr=8-1","false","true","98",,,"B08PPDJWC8","B08PPDJWC8","1","https://www.amazon.com/product-reviews/B08PPDJWC8?pageNumber=1&filterByStar=one_star&sortBy=helpful&formatType=all_formats&asin=B08PPDJWC8&reftag=cm_cr_arp_d_paging_btm_next_1&scope=reviewsAjax0","AWFUL. worked for 2 hrs and then crashed. Apple support said nothing they could do to help restore all the data that was lost and that we were shipped a complete piece of junk.","R3B0IPRSAL9KCK",,,,,,,,,"AWFUL. Do not purchase","https://www.amazon.com/gp/customer-reviews/R3B0IPRSAL9KCK","Reviewed in the United States on May 10, 2025","16635","1348",,,"Size: 256GB, Color: Green, Service Provider: Unlocked, Product grade: Renewed","B08PPDJWC8","Size","256GB","Color","Green","Service Provider","Unlocked","Product grade","Renewed"
"United States",,"2024-08-26",,"oneStar","https://www.amazon.com/Apple-iPhone-12-Mini-Black/dp/B08PPDJWC8/ref=sr_1_1?crid=6JEL7PMT16KU&dib=eyJ2IjoiMSJ9.BekHJGSAbG9Dm1eKkWWtBoxrLIAwfJjcfkmOec8VMXmJ5_gn_XCE4Z6cB84ZPqhNpoxs8vHUdTXy5ZJAAy_AuhPOHi79Fw8twlFPwGLCvMz1kK3VYJbRA9YDYHCfDHYLr2bjOGeHDBavT6EBh2LuQUT1HAjs2kRomRsCtMj8xeynLQq9wyKzjHqHzUnbufTY_5ojWllugueaJdvlq9VZHAbmf1eGilBLHZOnc5CrZKE.oJePQPVQKEaDe3aFMr5QiVCoE0pzCHCite0hve0WmlE&dib_tag=se&keywords=*+iPhone+12+mini&qid=1752790341&sprefix=iphone+12+mini%2Caps%2C631&sr=8-1","false","true","99",,,"B08PPDJWC8","B08PPDJWC8","1","https://www.amazon.com/product-reviews/B08PPDJWC8?pageNumber=1&filterByStar=one_star&sortBy=helpful&formatType=all_formats&asin=B08PPDJWC8&reftag=cm_cr_arp_d_paging_btm_next_1&scope=reviewsAjax0","I bought this phone and transferred everything over, everything Ok till I call someone or get a call, they hear me, but I can't hear them, very faint; only on speaker can hear, so I try calling the number that came with it to call for customer service and it says my call cannot be completed. Picture quality not good. online page they got back to me, They said they're sending another one but haven't seen it or have an order number/delivery message yet been a week now; so I hope they rectify this issue. Not very happy at this point. I paid a lot for this phone for being refurbished, don't usually go for them but someone once said to me; ya but they fix all the issues with them when they were new","R3MY4V7GOBVYTQ",,,,,,,,,"To have a phone that works properly","https://www.amazon.com/gp/customer-reviews/R3MY4V7GOBVYTQ","Reviewed in the United States on August 26, 2024","16635","1348",,,"Size: 256GB, Color: Black, Service Provider: Unlocked, Product grade: Renewed","B08PPDJWC8","Size","256GB","Color","Black","Service Provider","Unlocked","Product grade","Renewed"
"United States",,"2025-04-15",,"oneStar","https://www.amazon.com/Apple-iPhone-12-Mini-Black/dp/B08PPDJWC8/ref=sr_1_1?crid=6JEL7PMT16KU&dib=eyJ2IjoiMSJ9.BekHJGSAbG9Dm1eKkWWtBoxrLIAwfJjcfkmOec8VMXmJ5_gn_XCE4Z6cB84ZPqhNpoxs8vHUdTXy5ZJAAy_AuhPOHi79Fw8twlFPwGLCvMz1kK3VYJbRA9YDYHCfDHYLr2bjOGeHDBavT6EBh2LuQUT1HAjs2kRomRsCtMj8xeynLQq9wyKzjHqHzUnbufTY_5ojWllugueaJdvlq9VZHAbmf1eGilBLHZOnc5CrZKE.oJePQPVQKEaDe3aFMr5QiVCoE0pzCHCite0hve0WmlE&dib_tag=se&keywords=*+iPhone+12+mini&qid=1752790341&sprefix=iphone+12+mini%2Caps%2C631&sr=8-1","false","true","100",,,"B08PPDJWC8","B08PPDJWC8","1","https://www.amazon.com/product-reviews/B08PPDJWC8?pageNumber=1&filterByStar=one_star&sortBy=helpful&formatType=all_formats&asin=B08PPDJWC8&reftag=cm_cr_arp_d_paging_btm_next_1&scope=reviewsAjax0","I was very disappointed with this I phone 12 mini I payed a reverbished phone in excellent condition.i received a phone with plainly in view both bottom corners had severe scuff marks also the top left corner.phone wouldn't turn on even after I charged it over night. Now they say it could take 30 days for refund .","R2XWG7VA2XVGYU",,,,,,,,,"Not what I expected","https://www.amazon.com/gp/customer-reviews/R2XWG7VA2XVGYU","Reviewed in the United States on April 15, 2025","16635","1348",,,"Size: 64GB, Color: Black, Service Provider: Unlocked, Product grade: Renewed","B08PPDJWC8","Size","64GB","Color","Black","Service Provider","Unlocked","Product grade","Renewed"
"United States",,"2025-04-15",,"threeStar","https://www.amazon.com/Apple-iPhone-12-Mini-Black/dp/B08PPDJWC8/ref=sr_1_1?crid=6JEL7PMT16KU&dib=eyJ2IjoiMSJ9.BekHJGSAbG9Dm1eKkWWtBoxrLIAwfJjcfkmOec8VMXmJ5_gn_XCE4Z6cB84ZPqhNpoxs8vHUdTXy5ZJAAy_AuhPOHi79Fw8twlFPwGLCvMz1kK3VYJbRA9YDYHCfDHYLr2bjOGeHDBavT6EBh2LuQUT1HAjs2kRomRsCtMj8xeynLQq9wyKzjHqHzUnbufTY_5ojWllugueaJdvlq9VZHAbmf1eGilBLHZOnc5CrZKE.oJePQPVQKEaDe3aFMr5QiVCoE0pzCHCite0hve0WmlE&dib_tag=se&keywords=*+iPhone+12+mini&qid=1752790341&sprefix=iphone+12+mini%2Caps%2C631&sr=8-1","false","true","1",,,"B08PPDJWC8","B08PPDJWC8","3","https://www.amazon.com/product-reviews/B08PPDJWC8?pageNumber=1&filterByStar=three_star&sortBy=helpful&formatType=all_formats&asin=B08PPDJWC8&reftag=cm_cr_arp_d_paging_btm_next_1&scope=reviewsAjax0","I ordered 2 iphones from 2 different sellers: Amazon and 3 rd party seller Kanga supply. Review 1 renewed premium from Amazon. 5 stars: Bought this iphone 12 mini in renewed premium condition from Amazon (not a 3 rd party seller). Phone is in like new condition with a battery health of 99%. Package came sealed, and packed with care. Instructions were clear. Excellent product! Very happy with this purchase. Review 2: renewed premium from Kanga Supply. 2 stars Battery health is 81% which is unacceptable for renewed premium. Contacted Kanga supply and they offered a $20 refund which I declined. They will replace the phone after I return this one and it goes through their inspection which can take a couple of days. Very disappointed with the inconvenience they cause and their quality control. I will update my review when I receive the replacement. 2 out of 5.","R2X87JHB52R71X","https://m.media-amazon.com/images/I/71NGKtfF99L._SY88.jpg",,,,,,,"20","Renewed premium iphone 12 mini","https://www.amazon.com/gp/customer-reviews/R2X87JHB52R71X","Reviewed in the United States on April 15, 2025","16635","463",,,"Size: 64GB, Color: Green, Service Provider: Unlocked, Product grade: Renewed Premium","B08PPDJWC8","Size","64GB","Color","Green","Service Provider","Unlocked","Product grade","Renewed Premium"
"United States",,"2025-06-13",,"threeStar","https://www.amazon.com/Apple-iPhone-12-Mini-Black/dp/B08PPDJWC8/ref=sr_1_1?crid=6JEL7PMT16KU&dib=eyJ2IjoiMSJ9.BekHJGSAbG9Dm1eKkWWtBoxrLIAwfJjcfkmOec8VMXmJ5_gn_XCE4Z6cB84ZPqhNpoxs8vHUdTXy5ZJAAy_AuhPOHi79Fw8twlFPwGLCvMz1kK3VYJbRA9YDYHCfDHYLr2bjOGeHDBavT6EBh2LuQUT1HAjs2kRomRsCtMj8xeynLQq9wyKzjHqHzUnbufTY_5ojWllugueaJdvlq9VZHAbmf1eGilBLHZOnc5CrZKE.oJePQPVQKEaDe3aFMr5QiVCoE0pzCHCite0hve0WmlE&dib_tag=se&keywords=*+iPhone+12+mini&qid=1752790341&sprefix=iphone+12+mini%2Caps%2C631&sr=8-1","false","true","2",,,"B08PPDJWC8","B08PPDJWC8","3","https://www.amazon.com/product-reviews/B08PPDJWC8?pageNumber=1&filterByStar=three_star&sortBy=helpful&formatType=all_formats&asin=B08PPDJWC8&reftag=cm_cr_arp_d_paging_btm_next_1&scope=reviewsAjax0","Had this phone for 8 months, upgraded from an iPhone SE 2nd Gen, to and then to this iPhone 12 mini to a iPhone 16 Plus. I was really happy for the price ~$350. I was getting FaceID and I missed the 5 so I got something smaller. Besides the longer delivery time than what I'm used to on Amazon, it arrived and worked great. No issues. Until a couple of months in, I went to take a shower, came out and then the FaceID stopped working. I tried to return it and forgot what issues there was with the whole process. I still have it, one day the FaceID jsut came back to normal. To this day it still works great. I remeber the customer service being acceptable at best and then the phone just stopped working. To avoid more issues I just bought a new phone.","R2HJHQ5VJ43WFQ",,,,,,,,"3","Had Some Issues","https://www.amazon.com/gp/customer-reviews/R2HJHQ5VJ43WFQ","Reviewed in the United States on June 13, 2025","16635","463",,,"Size: 256GB, Color: White, Service Provider: Unlocked, Product grade: Renewed","B08PPDJWC8","Size","256GB","Color","White","Service Provider","Unlocked","Product grade","Renewed"
"United States",,"2025-07-08",,"threeStar","https://www.amazon.com/Apple-iPhone-12-Mini-Black/dp/B08PPDJWC8/ref=sr_1_1?crid=6JEL7PMT16KU&dib=eyJ2IjoiMSJ9.BekHJGSAbG9Dm1eKkWWtBoxrLIAwfJjcfkmOec8VMXmJ5_gn_XCE4Z6cB84ZPqhNpoxs8vHUdTXy5ZJAAy_AuhPOHi79Fw8twlFPwGLCvMz1kK3VYJbRA9YDYHCfDHYLr2bjOGeHDBavT6EBh2LuQUT1HAjs2kRomRsCtMj8xeynLQq9wyKzjHqHzUnbufTY_5ojWllugueaJdvlq9VZHAbmf1eGilBLHZOnc5CrZKE.oJePQPVQKEaDe3aFMr5QiVCoE0pzCHCite0hve0WmlE&dib_tag=se&keywords=*+iPhone+12+mini&qid=1752790341&sprefix=iphone+12+mini%2Caps%2C631&sr=8-1","false","true","3",,,"B08PPDJWC8","B08PPDJWC8","3","https://www.amazon.com/product-reviews/B08PPDJWC8?pageNumber=1&filterByStar=three_star&sortBy=helpful&formatType=all_formats&asin=B08PPDJWC8&reftag=cm_cr_arp_d_paging_btm_next_1&scope=reviewsAjax0","It worked fine then didn't want to update first time there was an update. months ago I tried to update it like it said to but the update said it couldn't be done and to check if the phone was actual iPhone. Which was weird , and I contacted seller to fix problem that's all I wanted and told them what it said before the return window expired they ignored me . So had to figure it out myself.","R1T1JN5F807VLK","https://m.media-amazon.com/images/I/61Ad5g9FgHL._SY88.jpg",,,,,,,,"Helpful info not with seller","https://www.amazon.com/gp/customer-reviews/R1T1JN5F807VLK","Reviewed in the United States on July 8, 2025","16635","463",,,"Size: 128GB, Color: (Product)Red, Service Provider: Unlocked, Product grade: Renewed","B08PPDJWC8","Size","128GB","Color","(Product)Red","Service Provider","Unlocked","Product grade","Renewed"
"United States",,"2025-06-15",,"threeStar","https://www.amazon.com/Apple-iPhone-12-Mini-Black/dp/B08PPDJWC8/ref=sr_1_1?crid=6JEL7PMT16KU&dib=eyJ2IjoiMSJ9.BekHJGSAbG9Dm1eKkWWtBoxrLIAwfJjcfkmOec8VMXmJ5_gn_XCE4Z6cB84ZPqhNpoxs8vHUdTXy5ZJAAy_AuhPOHi79Fw8twlFPwGLCvMz1kK3VYJbRA9YDYHCfDHYLr2bjOGeHDBavT6EBh2LuQUT1HAjs2kRomRsCtMj8xeynLQq9wyKzjHqHzUnbufTY_5ojWllugueaJdvlq9VZHAbmf1eGilBLHZOnc5CrZKE.oJePQPVQKEaDe3aFMr5QiVCoE0pzCHCite0hve0WmlE&dib_tag=se&keywords=*+iPhone+12+mini&qid=1752790341&sprefix=iphone+12+mini%2Caps%2C631&sr=8-1","false","true","4",,,"B08PPDJWC8","B08PPDJWC8","3","https://www.amazon.com/product-reviews/B08PPDJWC8?pageNumber=1&filterByStar=three_star&sortBy=helpful&formatType=all_formats&asin=B08PPDJWC8&reftag=cm_cr_arp_d_paging_btm_next_1&scope=reviewsAjax0","I have bought 2 iPhone 12 minis from this company, and both where In great physical condition, and the most recent one I bought still had the original apple screen protector deal on it, but the first one purchased the digitizer had dead spots, so the touch screen was unusable, and the second one has a bad battery. I can charge it to 100% and dies at about 60% and that 40% last about an hour. They had no problem returning the phone but was unfavorable to get another one that was broke again. Just wished the devices where tested before shipped to customers.","R2QC71DCVMVLTH",,,,,,,,,"Wish this company tested devices before shipping to customers","https://www.amazon.com/gp/customer-reviews/R2QC71DCVMVLTH","Reviewed in the United States on June 15, 2025","16635","463",,,"Size: 128GB, Color: Green, Service Provider: Unlocked, Product grade: Renewed","B08PPDJWC8","Size","128GB","Color","Green","Service Provider","Unlocked","Product grade","Renewed"
"United States",,"2025-07-08",,"threeStar","https://www.amazon.com/Apple-iPhone-12-Mini-Black/dp/B08PPDJWC8/ref=sr_1_1?crid=6JEL7PMT16KU&dib=eyJ2IjoiMSJ9.BekHJGSAbG9Dm1eKkWWtBoxrLIAwfJjcfkmOec8VMXmJ5_gn_XCE4Z6cB84ZPqhNpoxs8vHUdTXy5ZJAAy_AuhPOHi79Fw8twlFPwGLCvMz1kK3VYJbRA9YDYHCfDHYLr2bjOGeHDBavT6EBh2LuQUT1HAjs2kRomRsCtMj8xeynLQq9wyKzjHqHzUnbufTY_5ojWllugueaJdvlq9VZHAbmf1eGilBLHZOnc5CrZKE.oJePQPVQKEaDe3aFMr5QiVCoE0pzCHCite0hve0WmlE&dib_tag=se&keywords=*+iPhone+12+mini&qid=1752790341&sprefix=iphone+12+mini%2Caps%2C631&sr=8-1","false","true","5",,,"B08PPDJWC8","B08PPDJWC8","3","https://www.amazon.com/product-reviews/B08PPDJWC8?pageNumber=1&filterByStar=three_star&sortBy=helpful&formatType=all_formats&asin=B08PPDJWC8&reftag=cm_cr_arp_d_paging_btm_next_1&scope=reviewsAjax0","I am having issues with the speaker and the microphone. Everything sounds a little distorted and people are having difficulty understanding my on the phone. Debating returning it, but I can't do that until I buy another one.","R24O4F45W0EOSV",,,,,,,,,"Speaker and microphone issues","https://www.amazon.com/gp/customer-reviews/R24O4F45W0EOSV","Reviewed in the United States on July 8, 2025","16635","463",,,"Size: 256GB, Color: Black, Service Provider: Unlocked, Product grade: Renewed","B08PPDJWC8","Size","256GB","Color","Black","Service Provider","Unlocked","Product grade","Renewed"
"United States",,"2025-04-13",,"threeStar","https://www.amazon.com/Apple-iPhone-12-Mini-Black/dp/B08PPDJWC8/ref=sr_1_1?crid=6JEL7PMT16KU&dib=eyJ2IjoiMSJ9.BekHJGSAbG9Dm1eKkWWtBoxrLIAwfJjcfkmOec8VMXmJ5_gn_XCE4Z6cB84ZPqhNpoxs8vHUdTXy5ZJAAy_AuhPOHi79Fw8twlFPwGLCvMz1kK3VYJbRA9YDYHCfDHYLr2bjOGeHDBavT6EBh2LuQUT1HAjs2kRomRsCtMj8xeynLQq9wyKzjHqHzUnbufTY_5ojWllugueaJdvlq9VZHAbmf1eGilBLHZOnc5CrZKE.oJePQPVQKEaDe3aFMr5QiVCoE0pzCHCite0hve0WmlE&dib_tag=se&keywords=*+iPhone+12+mini&qid=1752790341&sprefix=iphone+12+mini%2Caps%2C631&sr=8-1","false","true","6",,,"B08PPDJWC8","B08PPDJWC8","3","https://www.amazon.com/product-reviews/B08PPDJWC8?pageNumber=1&filterByStar=three_star&sortBy=helpful&formatType=all_formats&asin=B08PPDJWC8&reftag=cm_cr_arp_d_paging_btm_next_1&scope=reviewsAjax0","Could've been better. I got this phone refurbished and in I think excellent or very good condition. But anytime a slight drop even on a carpeted surface or now at this point even if its not fallen me placing it on my car seat turns the phone off. It also came with what I assume is water damage where dots in the screen are yellow???? I was not impressed by this. Although battery life is excellent. But the main thing is it kept turning off and the sensor for when to turn the screen off during calls is broken where I can still call and hear the call but the screen wont turn on. This was all in the start of when I got it. No new problems have arise so I will deal with it but definitely not ordering again.","RFGCHR18UXHNT",,,,,,,,,"Sensor and Water/screen Damage when I got it.","https://www.amazon.com/gp/customer-reviews/RFGCHR18UXHNT","Reviewed in the United States on April 13, 2025","16635","463",,,"Size: 128GB, Color: Blue, Service Provider: Unlocked, Product grade: Renewed","B08PPDJWC8","Size","128GB","Color","Blue","Service Provider","Unlocked","Product grade","Renewed"
