"country","countryCode","date","filterByKeyword","filterByRating","input","isAmazonVine","isVerified","position","product/listPrice","product/price","productAsin","productOriginalAsin","ratingScore","reviewCategoryUrl","reviewDescription","reviewId","reviewImages/0","reviewImages/1","reviewImages/2","reviewImages/3","reviewImages/4","reviewImages/5","reviewImages/6","reviewReaction","reviewTitle","reviewUrl","reviewedIn","totalCategoryRatings","totalCategoryReviews","userId","userProfileLink","variant","variantAsin","variantAttributes/0/key","variantAttributes/0/value","variantAttributes/1/key","variantAttributes/1/value","variantAttributes/2/key","variantAttributes/2/value","variantAttributes/3/key","variantAttributes/3/value"
"United States",,"2023-04-08",,"fourStar","https://www.amazon.com/Apple-iPhone-12-Mini-Black/dp/B08PPDJWC8/ref=sr_1_1?crid=6JEL7PMT16KU&dib=eyJ2IjoiMSJ9.BekHJGSAbG9Dm1eKkWWtBoxrLIAwfJjcfkmOec8VMXmJ5_gn_XCE4Z6cB84ZPqhNpoxs8vHUdTXy5ZJAAy_AuhPOHi79Fw8twlFPwGLCvMz1kK3VYJbRA9YDYHCfDHYLr2bjOGeHDBavT6EBh2LuQUT1HAjs2kRomRsCtMj8xeynLQq9wyKzjHqHzUnbufTY_5ojWllugueaJdvlq9VZHAbmf1eGilBLHZOnc5CrZKE.oJePQPVQKEaDe3aFMr5QiVCoE0pzCHCite0hve0WmlE&dib_tag=se&keywords=*+iPhone+12+mini&qid=1752790341&sprefix=iphone+12+mini%2Caps%2C631&sr=8-1","false","true","91",,,"B08PPDJWC8","B08PPDJWC8","4","https://www.amazon.com/product-reviews/B08PPDJWC8?pageNumber=1&filterByStar=four_star&sortBy=helpful&formatType=all_formats&asin=B08PPDJWC8&reftag=cm_cr_arp_d_paging_btm_next_1&scope=reviewsAjax0","This phone arrived in perfect condition. no scratches as it was bought in “acceptable condition” and I appreciate that so much. It arrived updated to the latest iOS. The outside body had no scratches except a few on the screen which are barely noticeable as I have put a screen protector on. The phone is the Perfect size for my hand. I bought it for myself as a birthday gift and I don’t regret it at all. The only downside is that the battery is at 85% and as I am a frequent user of my phone I hope that won’t damage my experience. Overall good phone definitely recommend purchasing if you’re planning to. Update: it’s been around 3-4 months with the phone and I love it! The battery isn’t giving me any problems but always have my phone on low battery mode. Even with AirPods they don’t seem to drain my battery, the camera is amazing the screen i so clear. A perfect phone, I love it!!","R13WT4OR8DVB6E","https://m.media-amazon.com/images/I/71gJxowjkpL._SY88.jpg",,,,,,,"16","Def a good purchase","https://www.amazon.com/gp/customer-reviews/R13WT4OR8DVB6E","Reviewed in the United States on April 8, 2023","16635","638",,,"Size: 128GB, Color: White, Service Provider: Unlocked, Product grade: Renewed","B08PPDJWC8","Size","128GB","Color","White","Service Provider","Unlocked","Product grade","Renewed"
"United States",,"2024-05-21",,"fourStar","https://www.amazon.com/Apple-iPhone-12-Mini-Black/dp/B08PPDJWC8/ref=sr_1_1?crid=6JEL7PMT16KU&dib=eyJ2IjoiMSJ9.BekHJGSAbG9Dm1eKkWWtBoxrLIAwfJjcfkmOec8VMXmJ5_gn_XCE4Z6cB84ZPqhNpoxs8vHUdTXy5ZJAAy_AuhPOHi79Fw8twlFPwGLCvMz1kK3VYJbRA9YDYHCfDHYLr2bjOGeHDBavT6EBh2LuQUT1HAjs2kRomRsCtMj8xeynLQq9wyKzjHqHzUnbufTY_5ojWllugueaJdvlq9VZHAbmf1eGilBLHZOnc5CrZKE.oJePQPVQKEaDe3aFMr5QiVCoE0pzCHCite0hve0WmlE&dib_tag=se&keywords=*+iPhone+12+mini&qid=1752790341&sprefix=iphone+12+mini%2Caps%2C631&sr=8-1","false","true","92",,,"B08PPDJWC8","B08PPDJWC8","4","https://www.amazon.com/product-reviews/B08PPDJWC8?pageNumber=1&filterByStar=four_star&sortBy=helpful&formatType=all_formats&asin=B08PPDJWC8&reftag=cm_cr_arp_d_paging_btm_next_1&scope=reviewsAjax0","I needed a phone that would arrive in a quick time that wouldn’t break the bank. My iPhone 13 broke and the repair center would be a hefty sum to pay for the repairs. This phone is good but it has its drawbacks. The battery life can last ~4-5 hours depending on what apps you use (I received this phone at 86% battery health). Getting adjusted to this smaller keyboard takes a while but I’ve gotten lots of compliments on this phone.","R144GZ9T3WU042",,,,,,,,,"Decent phone","https://www.amazon.com/gp/customer-reviews/R144GZ9T3WU042","Reviewed in the United States on May 21, 2024","16635","638",,,"Size: 64GB, Color: White, Service Provider: Unlocked, Product grade: Renewed","B08PPDJWC8","Size","64GB","Color","White","Service Provider","Unlocked","Product grade","Renewed"
"United States",,"2024-07-20",,"fourStar","https://www.amazon.com/Apple-iPhone-12-Mini-Black/dp/B08PPDJWC8/ref=sr_1_1?crid=6JEL7PMT16KU&dib=eyJ2IjoiMSJ9.BekHJGSAbG9Dm1eKkWWtBoxrLIAwfJjcfkmOec8VMXmJ5_gn_XCE4Z6cB84ZPqhNpoxs8vHUdTXy5ZJAAy_AuhPOHi79Fw8twlFPwGLCvMz1kK3VYJbRA9YDYHCfDHYLr2bjOGeHDBavT6EBh2LuQUT1HAjs2kRomRsCtMj8xeynLQq9wyKzjHqHzUnbufTY_5ojWllugueaJdvlq9VZHAbmf1eGilBLHZOnc5CrZKE.oJePQPVQKEaDe3aFMr5QiVCoE0pzCHCite0hve0WmlE&dib_tag=se&keywords=*+iPhone+12+mini&qid=1752790341&sprefix=iphone+12+mini%2Caps%2C631&sr=8-1","false","true","93",,,"B08PPDJWC8","B08PPDJWC8","4","https://www.amazon.com/product-reviews/B08PPDJWC8?pageNumber=1&filterByStar=four_star&sortBy=helpful&formatType=all_formats&asin=B08PPDJWC8&reftag=cm_cr_arp_d_paging_btm_next_1&scope=reviewsAjax0","It's a pretty good phone phone the picture quality is pretty it came with some scratches but it didn't matter and after some month with it my sim was saying sos I thought that it was my sim problem but then I switched to another carrier and it still says sos............. If u need this phone to play its perfect but for business and Internet it's not that great, at least if u have unlimited wifi.","R8YRNHK3H7JRU",,,,,,,,,"It's pretty good but after 2 month the sim was not working","https://www.amazon.com/gp/customer-reviews/R8YRNHK3H7JRU","Reviewed in the United States on July 20, 2024","16635","638",,,"Size: 64GB, Color: White, Service Provider: Unlocked, Product grade: Renewed","B08PPDJWC8","Size","64GB","Color","White","Service Provider","Unlocked","Product grade","Renewed"
"United States",,"2024-08-11",,"fourStar","https://www.amazon.com/Apple-iPhone-12-Mini-Black/dp/B08PPDJWC8/ref=sr_1_1?crid=6JEL7PMT16KU&dib=eyJ2IjoiMSJ9.BekHJGSAbG9Dm1eKkWWtBoxrLIAwfJjcfkmOec8VMXmJ5_gn_XCE4Z6cB84ZPqhNpoxs8vHUdTXy5ZJAAy_AuhPOHi79Fw8twlFPwGLCvMz1kK3VYJbRA9YDYHCfDHYLr2bjOGeHDBavT6EBh2LuQUT1HAjs2kRomRsCtMj8xeynLQq9wyKzjHqHzUnbufTY_5ojWllugueaJdvlq9VZHAbmf1eGilBLHZOnc5CrZKE.oJePQPVQKEaDe3aFMr5QiVCoE0pzCHCite0hve0WmlE&dib_tag=se&keywords=*+iPhone+12+mini&qid=1752790341&sprefix=iphone+12+mini%2Caps%2C631&sr=8-1","false","true","94",,,"B08PPDJWC8","B08PPDJWC8","4","https://www.amazon.com/product-reviews/B08PPDJWC8?pageNumber=1&filterByStar=four_star&sortBy=helpful&formatType=all_formats&asin=B08PPDJWC8&reftag=cm_cr_arp_d_paging_btm_next_1&scope=reviewsAjax0","Phone arrived in perfect condition. Works as expected. Only reason for 4 stars is the 82% battery. It just clears the industry 80% minimum. I should have went for the extra money from someone that sells with a new battery. So add $79 to the cost for a new battery","RAWSSEX13ZRU8",,,,,,,,,"Decent phone","https://www.amazon.com/gp/customer-reviews/RAWSSEX13ZRU8","Reviewed in the United States on August 11, 2024","16635","638",,,"Size: 128GB, Color: Blue, Service Provider: Unlocked, Product grade: Renewed","B08PPDJWC8","Size","128GB","Color","Blue","Service Provider","Unlocked","Product grade","Renewed"
"United States",,"2024-05-18",,"fourStar","https://www.amazon.com/Apple-iPhone-12-Mini-Black/dp/B08PPDJWC8/ref=sr_1_1?crid=6JEL7PMT16KU&dib=eyJ2IjoiMSJ9.BekHJGSAbG9Dm1eKkWWtBoxrLIAwfJjcfkmOec8VMXmJ5_gn_XCE4Z6cB84ZPqhNpoxs8vHUdTXy5ZJAAy_AuhPOHi79Fw8twlFPwGLCvMz1kK3VYJbRA9YDYHCfDHYLr2bjOGeHDBavT6EBh2LuQUT1HAjs2kRomRsCtMj8xeynLQq9wyKzjHqHzUnbufTY_5ojWllugueaJdvlq9VZHAbmf1eGilBLHZOnc5CrZKE.oJePQPVQKEaDe3aFMr5QiVCoE0pzCHCite0hve0WmlE&dib_tag=se&keywords=*+iPhone+12+mini&qid=1752790341&sprefix=iphone+12+mini%2Caps%2C631&sr=8-1","false","true","95",,,"B08PPDJWC8","B08PPDJWC8","4","https://www.amazon.com/product-reviews/B08PPDJWC8?pageNumber=1&filterByStar=four_star&sortBy=helpful&formatType=all_formats&asin=B08PPDJWC8&reftag=cm_cr_arp_d_paging_btm_next_1&scope=reviewsAjax0","Came in good condition there was a very small scratch on the back but it’s barely noticeable and on the screen there were just two small scuffs that I hardly even see sometimes so it looked good but my only problem is the battery health, it came at 86% and not even 3 days after it dropped to 85% which is very disappointing. The camera is great, the phone overall is nice the mic works Face ID works just the battery health.","R3TCH2HO4FR4MW","https://m.media-amazon.com/images/I/61sqU-tfY9L._SY88.jpg","https://m.media-amazon.com/images/I/61uH7kgPlAL._SY88.jpg","https://m.media-amazon.com/images/I/71GVuUeFRcL._SY88.jpg","https://m.media-amazon.com/images/I/71Mj+Pl62ML._SY88.jpg",,,,"3","A bit disappointed","https://www.amazon.com/gp/customer-reviews/R3TCH2HO4FR4MW","Reviewed in the United States on May 18, 2024","16635","638",,,"Size: 128GB, Color: White, Service Provider: Unlocked, Product grade: Renewed","B08PPDJWC8","Size","128GB","Color","White","Service Provider","Unlocked","Product grade","Renewed"
"United States",,"2024-08-14",,"fourStar","https://www.amazon.com/Apple-iPhone-12-Mini-Black/dp/B08PPDJWC8/ref=sr_1_1?crid=6JEL7PMT16KU&dib=eyJ2IjoiMSJ9.BekHJGSAbG9Dm1eKkWWtBoxrLIAwfJjcfkmOec8VMXmJ5_gn_XCE4Z6cB84ZPqhNpoxs8vHUdTXy5ZJAAy_AuhPOHi79Fw8twlFPwGLCvMz1kK3VYJbRA9YDYHCfDHYLr2bjOGeHDBavT6EBh2LuQUT1HAjs2kRomRsCtMj8xeynLQq9wyKzjHqHzUnbufTY_5ojWllugueaJdvlq9VZHAbmf1eGilBLHZOnc5CrZKE.oJePQPVQKEaDe3aFMr5QiVCoE0pzCHCite0hve0WmlE&dib_tag=se&keywords=*+iPhone+12+mini&qid=1752790341&sprefix=iphone+12+mini%2Caps%2C631&sr=8-1","false","true","96",,,"B08PPDJWC8","B08PPDJWC8","4","https://www.amazon.com/product-reviews/B08PPDJWC8?pageNumber=1&filterByStar=four_star&sortBy=helpful&formatType=all_formats&asin=B08PPDJWC8&reftag=cm_cr_arp_d_paging_btm_next_1&scope=reviewsAjax0","I bought this phone wanting to transfer to apple from android and it did exactly that, phone arrived in great condition, only a few scratches and bumps on corners, I love this phone and all its features, plus the cameras are amazing! If you’re thinking about it do it!","R2ML9H9Q321OU1","https://m.media-amazon.com/images/I/61apGr9++2L._SY88.jpg",,,,,,,"2","Although I was a bit worried when I bought it, It was totally worth every penny!!","https://www.amazon.com/gp/customer-reviews/R2ML9H9Q321OU1","Reviewed in the United States on August 14, 2024","16635","638",,,"Size: 64GB, Color: White, Service Provider: Unlocked, Product grade: Renewed","B08PPDJWC8","Size","64GB","Color","White","Service Provider","Unlocked","Product grade","Renewed"
"United States",,"2024-10-22",,"fourStar","https://www.amazon.com/Apple-iPhone-12-Mini-Black/dp/B08PPDJWC8/ref=sr_1_1?crid=6JEL7PMT16KU&dib=eyJ2IjoiMSJ9.BekHJGSAbG9Dm1eKkWWtBoxrLIAwfJjcfkmOec8VMXmJ5_gn_XCE4Z6cB84ZPqhNpoxs8vHUdTXy5ZJAAy_AuhPOHi79Fw8twlFPwGLCvMz1kK3VYJbRA9YDYHCfDHYLr2bjOGeHDBavT6EBh2LuQUT1HAjs2kRomRsCtMj8xeynLQq9wyKzjHqHzUnbufTY_5ojWllugueaJdvlq9VZHAbmf1eGilBLHZOnc5CrZKE.oJePQPVQKEaDe3aFMr5QiVCoE0pzCHCite0hve0WmlE&dib_tag=se&keywords=*+iPhone+12+mini&qid=1752790341&sprefix=iphone+12+mini%2Caps%2C631&sr=8-1","false","true","97",,,"B08PPDJWC8","B08PPDJWC8","4","https://www.amazon.com/product-reviews/B08PPDJWC8?pageNumber=1&filterByStar=four_star&sortBy=helpful&formatType=all_formats&asin=B08PPDJWC8&reftag=cm_cr_arp_d_paging_btm_next_1&scope=reviewsAjax0","I am happy with the speed and size of this product. It hold a charge really well and charges really fast. Its way better than the 11.","R2BVE58MYQAGVS",,,,,,,,,"Works great","https://www.amazon.com/gp/customer-reviews/R2BVE58MYQAGVS","Reviewed in the United States on October 22, 2024","16635","638",,,"Size: 64GB, Color: Red, Service Provider: AT&amp;T, Product grade: Renewed","B08PPDJWC8","Size","64GB","Color","Red","Service Provider","AT&amp;T","Product grade","Renewed"
"United States",,"2024-09-09",,"fourStar","https://www.amazon.com/Apple-iPhone-12-Mini-Black/dp/B08PPDJWC8/ref=sr_1_1?crid=6JEL7PMT16KU&dib=eyJ2IjoiMSJ9.BekHJGSAbG9Dm1eKkWWtBoxrLIAwfJjcfkmOec8VMXmJ5_gn_XCE4Z6cB84ZPqhNpoxs8vHUdTXy5ZJAAy_AuhPOHi79Fw8twlFPwGLCvMz1kK3VYJbRA9YDYHCfDHYLr2bjOGeHDBavT6EBh2LuQUT1HAjs2kRomRsCtMj8xeynLQq9wyKzjHqHzUnbufTY_5ojWllugueaJdvlq9VZHAbmf1eGilBLHZOnc5CrZKE.oJePQPVQKEaDe3aFMr5QiVCoE0pzCHCite0hve0WmlE&dib_tag=se&keywords=*+iPhone+12+mini&qid=1752790341&sprefix=iphone+12+mini%2Caps%2C631&sr=8-1","false","true","98",,,"B08PPDJWC8","B08PPDJWC8","4","https://www.amazon.com/product-reviews/B08PPDJWC8?pageNumber=1&filterByStar=four_star&sortBy=helpful&formatType=all_formats&asin=B08PPDJWC8&reftag=cm_cr_arp_d_paging_btm_next_1&scope=reviewsAjax0","I purchased this reconditioned iPhone 12 Mini that was billed as in excellent condition, to be honest it's too dinged up in the corners and sides to be considered ""excellent condition"". The phone's screen is in excellent condition and the phone it self runs really well, so it's in nice condition in my opinion.","R5A7KUDERF8JB",,,,,,,,"7","Reconditioned iPhone 12 Mini was billed as in excellent condition, not so!","https://www.amazon.com/gp/customer-reviews/R5A7KUDERF8JB","Reviewed in the United States on September 9, 2024","16635","638",,,"Size: 64GB, Color: Blue, Service Provider: Unlocked, Product grade: Renewed","B08PPDJWC8","Size","64GB","Color","Blue","Service Provider","Unlocked","Product grade","Renewed"
"United States",,"2024-10-06",,"fourStar","https://www.amazon.com/Apple-iPhone-12-Mini-Black/dp/B08PPDJWC8/ref=sr_1_1?crid=6JEL7PMT16KU&dib=eyJ2IjoiMSJ9.BekHJGSAbG9Dm1eKkWWtBoxrLIAwfJjcfkmOec8VMXmJ5_gn_XCE4Z6cB84ZPqhNpoxs8vHUdTXy5ZJAAy_AuhPOHi79Fw8twlFPwGLCvMz1kK3VYJbRA9YDYHCfDHYLr2bjOGeHDBavT6EBh2LuQUT1HAjs2kRomRsCtMj8xeynLQq9wyKzjHqHzUnbufTY_5ojWllugueaJdvlq9VZHAbmf1eGilBLHZOnc5CrZKE.oJePQPVQKEaDe3aFMr5QiVCoE0pzCHCite0hve0WmlE&dib_tag=se&keywords=*+iPhone+12+mini&qid=1752790341&sprefix=iphone+12+mini%2Caps%2C631&sr=8-1","false","true","99",,,"B08PPDJWC8","B08PPDJWC8","4","https://www.amazon.com/product-reviews/B08PPDJWC8?pageNumber=1&filterByStar=four_star&sortBy=helpful&formatType=all_formats&asin=B08PPDJWC8&reftag=cm_cr_arp_d_paging_btm_next_1&scope=reviewsAjax0","The phone is used for everyday purposes. It's as good as a full sized phone except for the sound volume being not as loud as a full sized iPhone. Screen quality is good, all other functions on the phone work well.","R114QVK1DUI9ZQ",,,,,,,,,"Sound volume is not as loud as a full size iPhone.","https://www.amazon.com/gp/customer-reviews/R114QVK1DUI9ZQ","Reviewed in the United States on October 6, 2024","16635","638",,,"Size: 64GB, Color: Blue, Service Provider: Unlocked, Product grade: Renewed","B08PPDJWC8","Size","64GB","Color","Blue","Service Provider","Unlocked","Product grade","Renewed"
"United States",,"2024-09-01",,"fourStar","https://www.amazon.com/Apple-iPhone-12-Mini-Black/dp/B08PPDJWC8/ref=sr_1_1?crid=6JEL7PMT16KU&dib=eyJ2IjoiMSJ9.BekHJGSAbG9Dm1eKkWWtBoxrLIAwfJjcfkmOec8VMXmJ5_gn_XCE4Z6cB84ZPqhNpoxs8vHUdTXy5ZJAAy_AuhPOHi79Fw8twlFPwGLCvMz1kK3VYJbRA9YDYHCfDHYLr2bjOGeHDBavT6EBh2LuQUT1HAjs2kRomRsCtMj8xeynLQq9wyKzjHqHzUnbufTY_5ojWllugueaJdvlq9VZHAbmf1eGilBLHZOnc5CrZKE.oJePQPVQKEaDe3aFMr5QiVCoE0pzCHCite0hve0WmlE&dib_tag=se&keywords=*+iPhone+12+mini&qid=1752790341&sprefix=iphone+12+mini%2Caps%2C631&sr=8-1","false","true","100",,,"B08PPDJWC8","B08PPDJWC8","4","https://www.amazon.com/product-reviews/B08PPDJWC8?pageNumber=1&filterByStar=four_star&sortBy=helpful&formatType=all_formats&asin=B08PPDJWC8&reftag=cm_cr_arp_d_paging_btm_next_1&scope=reviewsAjax0","Product had a few issues (low battery life and case scratches). Seller unhesitatingly offered to replace battery and reimbursed us immediately upon proof of work done. Would gladly purchase again from this seller, would give 6 stars for customer care if I could.","R2OZ7UNLJ8JL9S",,,,,,,,,"Seller Customer Care is the Best, Won’t Let You Down!","https://www.amazon.com/gp/customer-reviews/R2OZ7UNLJ8JL9S","Reviewed in the United States on September 1, 2024","16635","638",,,"Size: 64GB, Color: Black, Service Provider: AT&amp;T, Product grade: Renewed","B08PPDJWC8","Size","64GB","Color","Black","Service Provider","AT&amp;T","Product grade","Renewed"
"United States",,"2025-01-28",,"twoStar","https://www.amazon.com/Apple-iPhone-12-Mini-Black/dp/B08PPDJWC8/ref=sr_1_1?crid=6JEL7PMT16KU&dib=eyJ2IjoiMSJ9.BekHJGSAbG9Dm1eKkWWtBoxrLIAwfJjcfkmOec8VMXmJ5_gn_XCE4Z6cB84ZPqhNpoxs8vHUdTXy5ZJAAy_AuhPOHi79Fw8twlFPwGLCvMz1kK3VYJbRA9YDYHCfDHYLr2bjOGeHDBavT6EBh2LuQUT1HAjs2kRomRsCtMj8xeynLQq9wyKzjHqHzUnbufTY_5ojWllugueaJdvlq9VZHAbmf1eGilBLHZOnc5CrZKE.oJePQPVQKEaDe3aFMr5QiVCoE0pzCHCite0hve0WmlE&dib_tag=se&keywords=*+iPhone+12+mini&qid=1752790341&sprefix=iphone+12+mini%2Caps%2C631&sr=8-1","false","true","1",,,"B08PPDJWC8","B08PPDJWC8","2","https://www.amazon.com/product-reviews/B08PPDJWC8?pageNumber=1&filterByStar=two_star&sortBy=helpful&formatType=all_formats&asin=B08PPDJWC8&reftag=cm_cr_arp_d_paging_btm_next_1&scope=reviewsAjax0","The iPhone 12 mini, refurbished was visually in great condition. Purchased in September 2024. The touchscreen didn’t seem sensitive enough. I tried changing settings, but still bothersome, especially around the edges. After warranty was out, several issues began with the battery. The first month or so, it required charging twice a day, with or without excessive use. I liked the size so much and the fact text messaging was a breeze, I tolerated it. December 2024- Then the battery began getting really hot. The touchscreen stopped responding. I removed the cover and even took the screen protector off (I was panicking)! I forced it to power down. After powering up again, I ran it in low power mode, which seemed to help and kept the phone functional. January 2025 - The phone would say it wasn’t charged, plug in and it indicated 70 - 89% charged; unplug, 2 -3%. Phone gave a message: Battery not recognized. Look in explanation, the battery is not Apple and may be incompatible. Next day, thankfully, it upgrades. Since then, screen sensitivity is much better and the battery seems ok. It doesn’t need charging as often. I just really enjoy that text messages are sent and received so easily and I don’t feel like I’m carrying around a mammoth of a phone. It also seems faster on the internet. Those are the reasons that I gave 2 stars. Also, it’s in a case and the screen has several cracks, from low level drops. This might be an Apple issue. The only other electronic device that I own that has cracked, is an iPad. No cracks on any of my android refurbished phones. In fact, I still have two around the house to use for shopping, internet searches, etc. This may just be the “luck of the draw” and I just happened to get a lemon. I’m going to try to limp along until at least a year, just to not feel too bad about spending the money. But when I buy, it will DEFINITELY be Android!","RTPC129BU5QVX",,,,,,,,,"Beware of BATTERY!","https://www.amazon.com/gp/customer-reviews/RTPC129BU5QVX","Reviewed in the United States on January 28, 2025","16635","394",,,"Size: 128GB, Color: Black, Service Provider: Unlocked, Product grade: Renewed","B08PPDJWC8","Size","128GB","Color","Black","Service Provider","Unlocked","Product grade","Renewed"
"United States",,"2025-06-19",,"twoStar","https://www.amazon.com/Apple-iPhone-12-Mini-Black/dp/B08PPDJWC8/ref=sr_1_1?crid=6JEL7PMT16KU&dib=eyJ2IjoiMSJ9.BekHJGSAbG9Dm1eKkWWtBoxrLIAwfJjcfkmOec8VMXmJ5_gn_XCE4Z6cB84ZPqhNpoxs8vHUdTXy5ZJAAy_AuhPOHi79Fw8twlFPwGLCvMz1kK3VYJbRA9YDYHCfDHYLr2bjOGeHDBavT6EBh2LuQUT1HAjs2kRomRsCtMj8xeynLQq9wyKzjHqHzUnbufTY_5ojWllugueaJdvlq9VZHAbmf1eGilBLHZOnc5CrZKE.oJePQPVQKEaDe3aFMr5QiVCoE0pzCHCite0hve0WmlE&dib_tag=se&keywords=*+iPhone+12+mini&qid=1752790341&sprefix=iphone+12+mini%2Caps%2C631&sr=8-1","false","true","2",,,"B08PPDJWC8","B08PPDJWC8","2","https://www.amazon.com/product-reviews/B08PPDJWC8?pageNumber=1&filterByStar=two_star&sortBy=helpful&formatType=all_formats&asin=B08PPDJWC8&reftag=cm_cr_arp_d_paging_btm_next_1&scope=reviewsAjax0","Compré un iPhone 12 mini ""renovado"" y la experiencia no fue la mejor. La batería llegó al 82%, lo cual está apenas por encima del mínimo para no tener que cambiarla inmediatamente. Para ser un producto reacondicionado, esperaba algo en mejores condiciones, al menos con una batería más decente. Además, el envío tardó más de lo anunciado, lo cual fue frustrante. No llegó en la fecha estimada, y no hubo información clara del seguimiento. En general, el teléfono funciona, pero por el precio esperaba algo mejor revisado. No lo recomendaría si esperas un reacondicionado ""como nuevo"".","R1VEIASM41Y9CG",,,,,,,,,"Cumple, pero con serios detalles","https://www.amazon.com/gp/customer-reviews/R1VEIASM41Y9CG","Reviewed in the United States on June 19, 2025","16635","394",,,"Size: 64GB, Color: Green, Service Provider: Unlocked, Product grade: Renewed","B08PPDJWC8","Size","64GB","Color","Green","Service Provider","Unlocked","Product grade","Renewed"
"United States",,"2025-04-19",,"twoStar","https://www.amazon.com/Apple-iPhone-12-Mini-Black/dp/B08PPDJWC8/ref=sr_1_1?crid=6JEL7PMT16KU&dib=eyJ2IjoiMSJ9.BekHJGSAbG9Dm1eKkWWtBoxrLIAwfJjcfkmOec8VMXmJ5_gn_XCE4Z6cB84ZPqhNpoxs8vHUdTXy5ZJAAy_AuhPOHi79Fw8twlFPwGLCvMz1kK3VYJbRA9YDYHCfDHYLr2bjOGeHDBavT6EBh2LuQUT1HAjs2kRomRsCtMj8xeynLQq9wyKzjHqHzUnbufTY_5ojWllugueaJdvlq9VZHAbmf1eGilBLHZOnc5CrZKE.oJePQPVQKEaDe3aFMr5QiVCoE0pzCHCite0hve0WmlE&dib_tag=se&keywords=*+iPhone+12+mini&qid=1752790341&sprefix=iphone+12+mini%2Caps%2C631&sr=8-1","false","true","3",,,"B08PPDJWC8","B08PPDJWC8","2","https://www.amazon.com/product-reviews/B08PPDJWC8?pageNumber=1&filterByStar=two_star&sortBy=helpful&formatType=all_formats&asin=B08PPDJWC8&reftag=cm_cr_arp_d_paging_btm_next_1&scope=reviewsAjax0","Front camera works fine, Back Camera looks blurry whenever I take photos, oh also, everytime I listen to music or play a YouTube video or any form of audio on this phone i turn the volume all the way up and then out of nowhere’s it goes down, for some reason it’s whenever I turn off the phone not fully but like turn the screen off and when it’s on Lock Screen the volume tells me it’s fully up but it sounds like it’s at a really low volume idk what’s going on with this phone, same thing with brightness sometimes it goes down and I already checked and I don’t have automatic brightness on or anything neither for audio and the audio volume says full when it sounds like it fluctuates. It must have some sort of sound damage or whatever it was supposed to be in “EXCELLENT CONDITION” it seems more like it should have been classified in good condition instead. Wouldn’t buy again. 👎","R2JIODTKZAGZTZ",,,,,,,,,"BAD Quality “supposed” “EXCELLENT CONDITION”","https://www.amazon.com/gp/customer-reviews/R2JIODTKZAGZTZ","Reviewed in the United States on April 19, 2025","16635","394",,,"Size: 64GB, Color: Black, Service Provider: Unlocked, Product grade: Renewed","B08PPDJWC8","Size","64GB","Color","Black","Service Provider","Unlocked","Product grade","Renewed"
"United States",,"2025-06-10",,"twoStar","https://www.amazon.com/Apple-iPhone-12-Mini-Black/dp/B08PPDJWC8/ref=sr_1_1?crid=6JEL7PMT16KU&dib=eyJ2IjoiMSJ9.BekHJGSAbG9Dm1eKkWWtBoxrLIAwfJjcfkmOec8VMXmJ5_gn_XCE4Z6cB84ZPqhNpoxs8vHUdTXy5ZJAAy_AuhPOHi79Fw8twlFPwGLCvMz1kK3VYJbRA9YDYHCfDHYLr2bjOGeHDBavT6EBh2LuQUT1HAjs2kRomRsCtMj8xeynLQq9wyKzjHqHzUnbufTY_5ojWllugueaJdvlq9VZHAbmf1eGilBLHZOnc5CrZKE.oJePQPVQKEaDe3aFMr5QiVCoE0pzCHCite0hve0WmlE&dib_tag=se&keywords=*+iPhone+12+mini&qid=1752790341&sprefix=iphone+12+mini%2Caps%2C631&sr=8-1","false","true","4",,,"B08PPDJWC8","B08PPDJWC8","2","https://www.amazon.com/product-reviews/B08PPDJWC8?pageNumber=1&filterByStar=two_star&sortBy=helpful&formatType=all_formats&asin=B08PPDJWC8&reftag=cm_cr_arp_d_paging_btm_next_1&scope=reviewsAjax0","Paint has rubbed off a lot on the top 2 corners. Phone has just been in my pocket. It is as off this phone was a different color and then painted to be matte black. I thought this does not happen with iphones? Is that normal?? I probably should have bought white. Other than that the phone is smaller than my old SE 2nd gen. I like that. I hate big phones!","R2C1NV87U2493J",,,,,,,,,"I LIKE IT BUT......","https://www.amazon.com/gp/customer-reviews/R2C1NV87U2493J","Reviewed in the United States on June 10, 2025","16635","394",,,"Size: 128GB, Color: Black, Service Provider: Unlocked, Product grade: Renewed","B08PPDJWC8","Size","128GB","Color","Black","Service Provider","Unlocked","Product grade","Renewed"
