"country","countryCode","date","filterByKeyword","filterByRating","input","isAmazonVine","isVerified","position","product/listPrice","product/price","productAsin","productOriginalAsin","ratingScore","reviewCategoryUrl","reviewDescription","reviewId","reviewImages/0","reviewImages/1","reviewImages/2","reviewImages/3","reviewImages/4","reviewImages/5","reviewReaction","reviewTitle","reviewUrl","reviewedIn","totalCategoryRatings","totalCategoryReviews","userId","userProfileLink","variant","variantAsin","variantAttributes/0/key","variantAttributes/0/value","variantAttributes/1/key","variantAttributes/1/value","variantAttributes/2/key","variantAttributes/2/value"
"United States",,"2025-06-26",,"oneStar","https://www.amazon.com/Apple-iPhone-14-Plus-Midnight/dp/B0BN9426PP/ref=sr_1_1?crid=1YDRM1CHK0LR1&dib=eyJ2IjoiMSJ9.o040dRgi6iTkUgX7ekvlm_S9Z_UmAaS0TJCNsqYCOvmpWh6dZob506tswq3H0tXaBqMK1pISJwqJCKb5gNGLhEms4resbb0P_OxUbjAOlij-VbbqzubxAVToYB5LZN9R8pI_UoUlwta_J7a0J1iUV6R3XS6lJnt6C3Hu0FNnVeJDe2VZwaOWY1wz82MJgVxWYEmHGW1oh1nzID8pMP0HsMJH_BAra2_dmY_uUTBxTvI.j9lL6bMk35SY4qS6zGLqbGUPrHiH2552Fz8G1uiMBDw&dib_tag=se&keywords=iphone%2B14%2Bplus&qid=1752825828&sprefix=iphone%2B14%2Bplus%2Caps%2C667&sr=8-1&th=1","false","true","6",,,"B0BN9426PP","B0BN9426PP","1","https://www.amazon.com/product-reviews/B0BN9426PP?pageNumber=1&filterByStar=one_star&sortBy=helpful&formatType=all_formats&asin=B0BN9426PP&reftag=cm_cr_arp_d_paging_btm_next_1&scope=reviewsAjax0","Just received this phone yesterday was very excited too finally upgrade from my iPhone XR which was also a refurbished iPhone and lasted me a long long time.. this iPhone 14 Plus wasn’t charging the port is broken and only way too charge it is if I hold it in a certain spot.. I don’t know how you send a phone out that’s not capable of charging to a customer even stating you have tested the phone before hand. Obviously not..","R2QG2Q2ST9O892",,,,,,,,"Broken Charging Port..","https://www.amazon.com/gp/customer-reviews/R2QG2Q2ST9O892","Reviewed in the United States on June 26, 2025","3876","349",,,"Service Provider: Unlocked, Color: Midnight, Size: 128GB","B0BN9426PP","Service Provider","Unlocked","Color","Midnight","Size","128GB"
"United States",,"2025-04-21",,"oneStar","https://www.amazon.com/Apple-iPhone-14-Plus-Midnight/dp/B0BN9426PP/ref=sr_1_1?crid=1YDRM1CHK0LR1&dib=eyJ2IjoiMSJ9.o040dRgi6iTkUgX7ekvlm_S9Z_UmAaS0TJCNsqYCOvmpWh6dZob506tswq3H0tXaBqMK1pISJwqJCKb5gNGLhEms4resbb0P_OxUbjAOlij-VbbqzubxAVToYB5LZN9R8pI_UoUlwta_J7a0J1iUV6R3XS6lJnt6C3Hu0FNnVeJDe2VZwaOWY1wz82MJgVxWYEmHGW1oh1nzID8pMP0HsMJH_BAra2_dmY_uUTBxTvI.j9lL6bMk35SY4qS6zGLqbGUPrHiH2552Fz8G1uiMBDw&dib_tag=se&keywords=iphone%2B14%2Bplus&qid=1752825828&sprefix=iphone%2B14%2Bplus%2Caps%2C667&sr=8-1&th=1","false","true","7",,,"B0BN9426PP","B0BN9426PP","1","https://www.amazon.com/product-reviews/B0BN9426PP?pageNumber=1&filterByStar=one_star&sortBy=helpful&formatType=all_formats&asin=B0BN9426PP&reftag=cm_cr_arp_d_paging_btm_next_1&scope=reviewsAjax0","DirectCertified shipped me a dud. It would randomly shutdown and restart. Took it to the local Apple Store for diagnostics. They said it had an internal hardware fault and wanted $449 to repair. Naturally, I am returning it. No more ‘refurbished’ junk for meGenius Bar Work Authorization ""Apple Genius Bar Problem Description/Diagnosis Issue: Customer states their device is unexpectedly restarting. Steps to Reproduce: Observed device restart in store multiple times. Observed multiple panics in logs of the device. Cosmetic Condition: Device has no physical damage and normal wear around enclosure. Proposed Resolution: Customer will go through original purchaser to attempt to return device due to device having a hardware issue upon receiving it. Repair of the device would cost $449 plus tax if customer would proceed with repair through Apple.""","RCNU1GZHGTW98",,,,,,,"3","Internal Hardware Fault!","https://www.amazon.com/gp/customer-reviews/RCNU1GZHGTW98","Reviewed in the United States on April 21, 2025","3876","349",,,"Service Provider: Unlocked, Color: Midnight, Size: 128GB","B0BN9426PP","Service Provider","Unlocked","Color","Midnight","Size","128GB"
"United States",,"2025-07-03",,"oneStar","https://www.amazon.com/Apple-iPhone-14-Plus-Midnight/dp/B0BN9426PP/ref=sr_1_1?crid=1YDRM1CHK0LR1&dib=eyJ2IjoiMSJ9.o040dRgi6iTkUgX7ekvlm_S9Z_UmAaS0TJCNsqYCOvmpWh6dZob506tswq3H0tXaBqMK1pISJwqJCKb5gNGLhEms4resbb0P_OxUbjAOlij-VbbqzubxAVToYB5LZN9R8pI_UoUlwta_J7a0J1iUV6R3XS6lJnt6C3Hu0FNnVeJDe2VZwaOWY1wz82MJgVxWYEmHGW1oh1nzID8pMP0HsMJH_BAra2_dmY_uUTBxTvI.j9lL6bMk35SY4qS6zGLqbGUPrHiH2552Fz8G1uiMBDw&dib_tag=se&keywords=iphone%2B14%2Bplus&qid=1752825828&sprefix=iphone%2B14%2Bplus%2Caps%2C667&sr=8-1&th=1","false","true","8",,,"B0BN9426PP","B0BN9426PP","1","https://www.amazon.com/product-reviews/B0BN9426PP?pageNumber=1&filterByStar=one_star&sortBy=helpful&formatType=all_formats&asin=B0BN9426PP&reftag=cm_cr_arp_d_paging_btm_next_1&scope=reviewsAjax0","Beware of this seller…This refurbished iPhone was $399. We tried using it since March 1- and the data would turn off randomly. Everything else worked great. My husband would turn it on - Found out this week from a tech that it is a hardware cellular component issue. It also says this when you dig deeper into the diagnostics on the phone. Very disappointed. It was my daughter’s bday gift.","R1GI2BQ5LVSRMY","https://m.media-amazon.com/images/I/71FQlvnS2qL._SY88.jpg",,,,,,,"Faulty phone","https://www.amazon.com/gp/customer-reviews/R1GI2BQ5LVSRMY","Reviewed in the United States on July 3, 2025","3876","349",,,"Service Provider: Unlocked, Color: Purple, Size: 128GB","B0BN9426PP","Service Provider","Unlocked","Color","Purple","Size","128GB"
"United States",,"2025-07-05",,"oneStar","https://www.amazon.com/Apple-iPhone-14-Plus-Midnight/dp/B0BN9426PP/ref=sr_1_1?crid=1YDRM1CHK0LR1&dib=eyJ2IjoiMSJ9.o040dRgi6iTkUgX7ekvlm_S9Z_UmAaS0TJCNsqYCOvmpWh6dZob506tswq3H0tXaBqMK1pISJwqJCKb5gNGLhEms4resbb0P_OxUbjAOlij-VbbqzubxAVToYB5LZN9R8pI_UoUlwta_J7a0J1iUV6R3XS6lJnt6C3Hu0FNnVeJDe2VZwaOWY1wz82MJgVxWYEmHGW1oh1nzID8pMP0HsMJH_BAra2_dmY_uUTBxTvI.j9lL6bMk35SY4qS6zGLqbGUPrHiH2552Fz8G1uiMBDw&dib_tag=se&keywords=iphone%2B14%2Bplus&qid=1752825828&sprefix=iphone%2B14%2Bplus%2Caps%2C667&sr=8-1&th=1","false","true","9",,,"B0BN9426PP","B0BN9426PP","1","https://www.amazon.com/product-reviews/B0BN9426PP?pageNumber=1&filterByStar=one_star&sortBy=helpful&formatType=all_formats&asin=B0BN9426PP&reftag=cm_cr_arp_d_paging_btm_next_1&scope=reviewsAjax0","The phone works well except the flashlight and camera flash work intermittently. I asked customer support if this was a known issue and they couldn’t or wouldn’t tell me and then offered me a partial refund. This was my first and last time buying from this seller. I think I’d have better luck taking the phone to apple anyway. If you are thinking of ordering please be wary. Customer service won’t help.","R3FQG7ZEB8IBGX",,,,,,,,"No help from seller","https://www.amazon.com/gp/customer-reviews/R3FQG7ZEB8IBGX","Reviewed in the United States on July 5, 2025","3876","349",,,"Service Provider: Unlocked, Color: Blue, Size: 128GB","B0BN9426PP","Service Provider","Unlocked","Color","Blue","Size","128GB"
"United States",,"2025-07-10",,"oneStar","https://www.amazon.com/Apple-iPhone-14-Plus-Midnight/dp/B0BN9426PP/ref=sr_1_1?crid=1YDRM1CHK0LR1&dib=eyJ2IjoiMSJ9.o040dRgi6iTkUgX7ekvlm_S9Z_UmAaS0TJCNsqYCOvmpWh6dZob506tswq3H0tXaBqMK1pISJwqJCKb5gNGLhEms4resbb0P_OxUbjAOlij-VbbqzubxAVToYB5LZN9R8pI_UoUlwta_J7a0J1iUV6R3XS6lJnt6C3Hu0FNnVeJDe2VZwaOWY1wz82MJgVxWYEmHGW1oh1nzID8pMP0HsMJH_BAra2_dmY_uUTBxTvI.j9lL6bMk35SY4qS6zGLqbGUPrHiH2552Fz8G1uiMBDw&dib_tag=se&keywords=iphone%2B14%2Bplus&qid=1752825828&sprefix=iphone%2B14%2Bplus%2Caps%2C667&sr=8-1&th=1","false","true","10",,,"B0BN9426PP","B0BN9426PP","1","https://www.amazon.com/product-reviews/B0BN9426PP?pageNumber=1&filterByStar=one_star&sortBy=helpful&formatType=all_formats&asin=B0BN9426PP&reftag=cm_cr_arp_d_paging_btm_next_1&scope=reviewsAjax0","Do not pay this phone Phone is damaged, the nfc chip is defective n the satellite service keeps going out so i kept missing my calls , calls dropping when i could answer then the apple pay wasn’t working so i took it to apple and they said the phone is damaged and i need to contact the company i got it from","R2XXGBX25HVJ8A",,,,,,,,"Dont","https://www.amazon.com/gp/customer-reviews/R2XXGBX25HVJ8A","Reviewed in the United States on July 10, 2025","3876","349",,,"Service Provider: Unlocked, Color: Purple, Size: 128GB","B0BN9426PP","Service Provider","Unlocked","Color","Purple","Size","128GB"
"United States",,"2025-05-11",,"oneStar","https://www.amazon.com/Apple-iPhone-14-Plus-Midnight/dp/B0BN9426PP/ref=sr_1_1?crid=1YDRM1CHK0LR1&dib=eyJ2IjoiMSJ9.o040dRgi6iTkUgX7ekvlm_S9Z_UmAaS0TJCNsqYCOvmpWh6dZob506tswq3H0tXaBqMK1pISJwqJCKb5gNGLhEms4resbb0P_OxUbjAOlij-VbbqzubxAVToYB5LZN9R8pI_UoUlwta_J7a0J1iUV6R3XS6lJnt6C3Hu0FNnVeJDe2VZwaOWY1wz82MJgVxWYEmHGW1oh1nzID8pMP0HsMJH_BAra2_dmY_uUTBxTvI.j9lL6bMk35SY4qS6zGLqbGUPrHiH2552Fz8G1uiMBDw&dib_tag=se&keywords=iphone%2B14%2Bplus&qid=1752825828&sprefix=iphone%2B14%2Bplus%2Caps%2C667&sr=8-1&th=1","false","true","11",,,"B0BN9426PP","B0BN9426PP","1","https://www.amazon.com/product-reviews/B0BN9426PP?pageNumber=1&filterByStar=one_star&sortBy=helpful&formatType=all_formats&asin=B0BN9426PP&reftag=cm_cr_arp_d_paging_btm_next_1&scope=reviewsAjax0","Ordered this refurbished Iphone, and it stalled and constantly hung on each screen. Would have to power off to get it unstuck. That was understandable that a phone could have issues. This part is 100 percent my error. At the same time i returned a case and switched the labels. This seller did not even bother to communicate the mistake when he received the case back instead of the iPhone. That alone deserves less than a one star. Now i am out the full cost of the phone. It is impossible to communicate with the seller that has the iPhone. The worst experience of sellers I've ever known.","R1E3JQRDK9JJAM",,,,,,,,"Worst Amazon experience ever. FAULTY PHONE","https://www.amazon.com/gp/customer-reviews/R1E3JQRDK9JJAM","Reviewed in the United States on May 11, 2025","3876","349",,,"Service Provider: Unlocked, Color: Purple, Size: 128GB","B0BN9426PP","Service Provider","Unlocked","Color","Purple","Size","128GB"
"United States",,"2025-07-14",,"oneStar","https://www.amazon.com/Apple-iPhone-14-Plus-Midnight/dp/B0BN9426PP/ref=sr_1_1?crid=1YDRM1CHK0LR1&dib=eyJ2IjoiMSJ9.o040dRgi6iTkUgX7ekvlm_S9Z_UmAaS0TJCNsqYCOvmpWh6dZob506tswq3H0tXaBqMK1pISJwqJCKb5gNGLhEms4resbb0P_OxUbjAOlij-VbbqzubxAVToYB5LZN9R8pI_UoUlwta_J7a0J1iUV6R3XS6lJnt6C3Hu0FNnVeJDe2VZwaOWY1wz82MJgVxWYEmHGW1oh1nzID8pMP0HsMJH_BAra2_dmY_uUTBxTvI.j9lL6bMk35SY4qS6zGLqbGUPrHiH2552Fz8G1uiMBDw&dib_tag=se&keywords=iphone%2B14%2Bplus&qid=1752825828&sprefix=iphone%2B14%2Bplus%2Caps%2C667&sr=8-1&th=1","false","true","12",,,"B0BN9426PP","B0BN9426PP","1","https://www.amazon.com/product-reviews/B0BN9426PP?pageNumber=1&filterByStar=one_star&sortBy=helpful&formatType=all_formats&asin=B0BN9426PP&reftag=cm_cr_arp_d_paging_btm_next_1&scope=reviewsAjax0","Do not buy these phones! Had one with a touch screen that barely worked so I ordered another it was seemingly perfect for two whole days before it began restarting every few minutes! It went black 6 times before I even had my lunch at work! two pieces of junk what a waste of time and money !","R2J6FQL8Z43O5W",,,,,,,,"Buyer Beware!","https://www.amazon.com/gp/customer-reviews/R2J6FQL8Z43O5W","Reviewed in the United States on July 14, 2025","3876","349",,,"Service Provider: Unlocked, Color: (PRODUCT)Red, Size: 128GB","B0BN9426PP","Service Provider","Unlocked","Color","(PRODUCT)Red","Size","128GB"
"United States",,"2025-06-30",,"oneStar","https://www.amazon.com/Apple-iPhone-14-Plus-Midnight/dp/B0BN9426PP/ref=sr_1_1?crid=1YDRM1CHK0LR1&dib=eyJ2IjoiMSJ9.o040dRgi6iTkUgX7ekvlm_S9Z_UmAaS0TJCNsqYCOvmpWh6dZob506tswq3H0tXaBqMK1pISJwqJCKb5gNGLhEms4resbb0P_OxUbjAOlij-VbbqzubxAVToYB5LZN9R8pI_UoUlwta_J7a0J1iUV6R3XS6lJnt6C3Hu0FNnVeJDe2VZwaOWY1wz82MJgVxWYEmHGW1oh1nzID8pMP0HsMJH_BAra2_dmY_uUTBxTvI.j9lL6bMk35SY4qS6zGLqbGUPrHiH2552Fz8G1uiMBDw&dib_tag=se&keywords=iphone%2B14%2Bplus&qid=1752825828&sprefix=iphone%2B14%2Bplus%2Caps%2C667&sr=8-1&th=1","false","true","13",,,"B0BN9426PP","B0BN9426PP","1","https://www.amazon.com/product-reviews/B0BN9426PP?pageNumber=1&filterByStar=one_star&sortBy=helpful&formatType=all_formats&asin=B0BN9426PP&reftag=cm_cr_arp_d_paging_btm_next_1&scope=reviewsAjax0","SELLER SOLD A DEMO PHONE. I did not realize it was a demo phone until after the return period. That should not matter because the phone is not as described and has limited capabilities. But seller refuses to work with me. They essentially stole almost $400 and now I have a phone I can't use.","R1XIJIHAB7WXU",,,,,,,,"Seller Sold a Demo Phone, not Real Phone","https://www.amazon.com/gp/customer-reviews/R1XIJIHAB7WXU","Reviewed in the United States on June 30, 2025","3876","349",,,"Service Provider: AT&amp;T, Color: Purple, Size: 128GB","B0BN9426PP","Service Provider","AT&amp;T","Color","Purple","Size","128GB"
"United States",,"2024-11-21",,"oneStar","https://www.amazon.com/Apple-iPhone-14-Plus-Midnight/dp/B0BN9426PP/ref=sr_1_1?crid=1YDRM1CHK0LR1&dib=eyJ2IjoiMSJ9.o040dRgi6iTkUgX7ekvlm_S9Z_UmAaS0TJCNsqYCOvmpWh6dZob506tswq3H0tXaBqMK1pISJwqJCKb5gNGLhEms4resbb0P_OxUbjAOlij-VbbqzubxAVToYB5LZN9R8pI_UoUlwta_J7a0J1iUV6R3XS6lJnt6C3Hu0FNnVeJDe2VZwaOWY1wz82MJgVxWYEmHGW1oh1nzID8pMP0HsMJH_BAra2_dmY_uUTBxTvI.j9lL6bMk35SY4qS6zGLqbGUPrHiH2552Fz8G1uiMBDw&dib_tag=se&keywords=iphone%2B14%2Bplus&qid=1752825828&sprefix=iphone%2B14%2Bplus%2Caps%2C667&sr=8-1&th=1","false","true","14",,,"B0BN9426PP","B0BN9426PP","1","https://www.amazon.com/product-reviews/B0BN9426PP?pageNumber=1&filterByStar=one_star&sortBy=helpful&formatType=all_formats&asin=B0BN9426PP&reftag=cm_cr_arp_d_paging_btm_next_1&scope=reviewsAjax0","I had the phone about a month when it locked up. We could do nothing but take the I phone to an APPLE repair shop in Plano Texas. They could not open phone. They did clean out all the information and pictures that my had for several years. We sent phone back with Amazon label. The company the phone was sent from got the phone and said they couldn’t open it . I had to go through Amazon to get messages back from seller. They seem to not plan to refund over 5 hundred dollars until they can open phone. The reason I sent phone back to begin with. I have been going back and forth for over a month and can’t get my refund. Amazon is just the go between. And they can’t help, even though I bought the phone from Amazon. I still have not gotten my money back for an iPhone that lasted one month. Never been so disappointed in my life with the poor help I got from Amazon. $500 since last October.","R1LI05N9D9JN8M",,,,,,,"27","I Phone 14","https://www.amazon.com/gp/customer-reviews/R1LI05N9D9JN8M","Reviewed in the United States on November 21, 2024","3876","349",,,"Service Provider: Unlocked, Color: Purple, Size: 128GB","B0BN9426PP","Service Provider","Unlocked","Color","Purple","Size","128GB"
"United States",,"2025-05-10",,"oneStar","https://www.amazon.com/Apple-iPhone-14-Plus-Midnight/dp/B0BN9426PP/ref=sr_1_1?crid=1YDRM1CHK0LR1&dib=eyJ2IjoiMSJ9.o040dRgi6iTkUgX7ekvlm_S9Z_UmAaS0TJCNsqYCOvmpWh6dZob506tswq3H0tXaBqMK1pISJwqJCKb5gNGLhEms4resbb0P_OxUbjAOlij-VbbqzubxAVToYB5LZN9R8pI_UoUlwta_J7a0J1iUV6R3XS6lJnt6C3Hu0FNnVeJDe2VZwaOWY1wz82MJgVxWYEmHGW1oh1nzID8pMP0HsMJH_BAra2_dmY_uUTBxTvI.j9lL6bMk35SY4qS6zGLqbGUPrHiH2552Fz8G1uiMBDw&dib_tag=se&keywords=iphone%2B14%2Bplus&qid=1752825828&sprefix=iphone%2B14%2Bplus%2Caps%2C667&sr=8-1&th=1","false","true","15",,,"B0BN9426PP","B0BN9426PP","1","https://www.amazon.com/product-reviews/B0BN9426PP?pageNumber=1&filterByStar=one_star&sortBy=helpful&formatType=all_formats&asin=B0BN9426PP&reftag=cm_cr_arp_d_paging_btm_next_1&scope=reviewsAjax0","Ordené este producto en condición “excelente”, lo que supone recibir un artículo en estado casi perfecto. Lamentablemente, no fue así. El dispositivo llegó con rayones visibles tanto en el cuerpo como en la pantalla, problemas con la eSIM, y una batería con solo el 83% de capacidad. Además, me informaron que la pantalla está deformada, lo que impide colocarle un protector de vidrio correctamente. Una verdadera decepción. No lo recomiendo si estás buscando un producto en buen estado o mínimamente cercano a lo prometido.","RSRT4PPD0U4SG",,,,,,,,"No cumple con lo prometido","https://www.amazon.com/gp/customer-reviews/RSRT4PPD0U4SG","Reviewed in the United States on May 10, 2025","3876","349",,,"Service Provider: Unlocked, Color: Blue, Size: 256GB","B0BN9426PP","Service Provider","Unlocked","Color","Blue","Size","256GB"
"United States",,"2024-09-04",,"oneStar","https://www.amazon.com/Apple-iPhone-14-Plus-Midnight/dp/B0BN9426PP/ref=sr_1_1?crid=1YDRM1CHK0LR1&dib=eyJ2IjoiMSJ9.o040dRgi6iTkUgX7ekvlm_S9Z_UmAaS0TJCNsqYCOvmpWh6dZob506tswq3H0tXaBqMK1pISJwqJCKb5gNGLhEms4resbb0P_OxUbjAOlij-VbbqzubxAVToYB5LZN9R8pI_UoUlwta_J7a0J1iUV6R3XS6lJnt6C3Hu0FNnVeJDe2VZwaOWY1wz82MJgVxWYEmHGW1oh1nzID8pMP0HsMJH_BAra2_dmY_uUTBxTvI.j9lL6bMk35SY4qS6zGLqbGUPrHiH2552Fz8G1uiMBDw&dib_tag=se&keywords=iphone%2B14%2Bplus&qid=1752825828&sprefix=iphone%2B14%2Bplus%2Caps%2C667&sr=8-1&th=1","false","true","16",,,"B0BN9426PP","B0BN9426PP","1","https://www.amazon.com/product-reviews/B0BN9426PP?pageNumber=1&filterByStar=one_star&sortBy=helpful&formatType=all_formats&asin=B0BN9426PP&reftag=cm_cr_arp_d_paging_btm_next_1&scope=reviewsAjax0","Here's an update: I'm surprised by what happened. Never expected this..... Phone locked after 90 days. In the upper right near the battery status SOS appeared. It took 4 days to determine that the previous carrier locked the phone because the original owner did not pay their bill or honor their contract. T-Moble could not fix or unlock it so Amazon support contacted the seller. They said to send it back... Meanwhile I was able to take my old iPhone 8 to a ""corporate"" owned store to reactivate my phone. Independent store want's to charge fees. A new sim card was all that was needed. I missed text messages but 8 of the voice messages that were missed loaded on the iPhone 8 the moment it was activated. This was my 3rd iPhone with the previous lasting over 6 years. Transferring data was simple and took about 15 minutes. My only problem is I'm not able to connect my Nest thermostat with Google Home. Tried everything and still get an error message ""Something went wrong"". Recommended. See update . Does everything I need and the bigger screen is just right. Cons: Almost twice the weight of my iPhone 8.","R14NBLU62SLLTC",,,,,,,,"Big leap from an iPhone 8 however...","https://www.amazon.com/gp/customer-reviews/R14NBLU62SLLTC","Reviewed in the United States on September 4, 2024","3876","349",,,"Service Provider: T-Mobile, Color: Midnight, Size: 128GB","B0BN9426PP","Service Provider","T-Mobile","Color","Midnight","Size","128GB"
"United States",,"2025-07-09",,"oneStar","https://www.amazon.com/Apple-iPhone-14-Plus-Midnight/dp/B0BN9426PP/ref=sr_1_1?crid=1YDRM1CHK0LR1&dib=eyJ2IjoiMSJ9.o040dRgi6iTkUgX7ekvlm_S9Z_UmAaS0TJCNsqYCOvmpWh6dZob506tswq3H0tXaBqMK1pISJwqJCKb5gNGLhEms4resbb0P_OxUbjAOlij-VbbqzubxAVToYB5LZN9R8pI_UoUlwta_J7a0J1iUV6R3XS6lJnt6C3Hu0FNnVeJDe2VZwaOWY1wz82MJgVxWYEmHGW1oh1nzID8pMP0HsMJH_BAra2_dmY_uUTBxTvI.j9lL6bMk35SY4qS6zGLqbGUPrHiH2552Fz8G1uiMBDw&dib_tag=se&keywords=iphone%2B14%2Bplus&qid=1752825828&sprefix=iphone%2B14%2Bplus%2Caps%2C667&sr=8-1&th=1","false","true","17",,,"B0BN9426PP","B0BN9426PP","1","https://www.amazon.com/product-reviews/B0BN9426PP?pageNumber=1&filterByStar=one_star&sortBy=helpful&formatType=all_formats&asin=B0BN9426PP&reftag=cm_cr_arp_d_paging_btm_next_1&scope=reviewsAjax0","I purchased this phone that worked for less than a year. I started having issues with the software almost right away. I do not recommend this seller because they do not stand behind their faulty products after 90 days.","R19OCZZVVY5IN1",,,,,,,,"Buyer beware!","https://www.amazon.com/gp/customer-reviews/R19OCZZVVY5IN1","Reviewed in the United States on July 9, 2025","3876","349",,,"Service Provider: Unlocked, Color: Purple, Size: 128GB","B0BN9426PP","Service Provider","Unlocked","Color","Purple","Size","128GB"
"United States",,"2025-05-24",,"oneStar","https://www.amazon.com/Apple-iPhone-14-Plus-Midnight/dp/B0BN9426PP/ref=sr_1_1?crid=1YDRM1CHK0LR1&dib=eyJ2IjoiMSJ9.o040dRgi6iTkUgX7ekvlm_S9Z_UmAaS0TJCNsqYCOvmpWh6dZob506tswq3H0tXaBqMK1pISJwqJCKb5gNGLhEms4resbb0P_OxUbjAOlij-VbbqzubxAVToYB5LZN9R8pI_UoUlwta_J7a0J1iUV6R3XS6lJnt6C3Hu0FNnVeJDe2VZwaOWY1wz82MJgVxWYEmHGW1oh1nzID8pMP0HsMJH_BAra2_dmY_uUTBxTvI.j9lL6bMk35SY4qS6zGLqbGUPrHiH2552Fz8G1uiMBDw&dib_tag=se&keywords=iphone%2B14%2Bplus&qid=1752825828&sprefix=iphone%2B14%2Bplus%2Caps%2C667&sr=8-1&th=1","false","true","18",,,"B0BN9426PP","B0BN9426PP","1","https://www.amazon.com/product-reviews/B0BN9426PP?pageNumber=1&filterByStar=one_star&sortBy=helpful&formatType=all_formats&asin=B0BN9426PP&reftag=cm_cr_arp_d_paging_btm_next_1&scope=reviewsAjax0","Apenas recibi el telefono el miercoles y desde ayer el touch no funciona, no carga con su cargador solo en una estacion de carga y no completa la carga se queda en un 70 % encima de eso se calienta por detras incluyendo la camara, ahora estoy averiguando como borro mis datos de este telefono para devolvelo lo mas pronto posible.","R10L4K7U91VBPU",,,,,,,,"no vale la pena","https://www.amazon.com/gp/customer-reviews/R10L4K7U91VBPU","Reviewed in the United States on May 24, 2025","3876","349",,,"Service Provider: Unlocked, Color: Blue, Size: 128GB","B0BN9426PP","Service Provider","Unlocked","Color","Blue","Size","128GB"
"United States",,"2025-07-12",,"oneStar","https://www.amazon.com/Apple-iPhone-14-Plus-Midnight/dp/B0BN9426PP/ref=sr_1_1?crid=1YDRM1CHK0LR1&dib=eyJ2IjoiMSJ9.o040dRgi6iTkUgX7ekvlm_S9Z_UmAaS0TJCNsqYCOvmpWh6dZob506tswq3H0tXaBqMK1pISJwqJCKb5gNGLhEms4resbb0P_OxUbjAOlij-VbbqzubxAVToYB5LZN9R8pI_UoUlwta_J7a0J1iUV6R3XS6lJnt6C3Hu0FNnVeJDe2VZwaOWY1wz82MJgVxWYEmHGW1oh1nzID8pMP0HsMJH_BAra2_dmY_uUTBxTvI.j9lL6bMk35SY4qS6zGLqbGUPrHiH2552Fz8G1uiMBDw&dib_tag=se&keywords=iphone%2B14%2Bplus&qid=1752825828&sprefix=iphone%2B14%2Bplus%2Caps%2C667&sr=8-1&th=1","false","true","19",,,"B0BN9426PP","B0BN9426PP","1","https://www.amazon.com/product-reviews/B0BN9426PP?pageNumber=1&filterByStar=one_star&sortBy=helpful&formatType=all_formats&asin=B0BN9426PP&reftag=cm_cr_arp_d_paging_btm_next_1&scope=reviewsAjax0","I dislike everything about this purchase. There are scratches EVERYWHERE especially around the edges. There is also a small CRACK on the screen. The camera is blurry and for some reason I can’t connect to any wifi.","R21FHEV4PB4H6J","https://m.media-amazon.com/images/I/61TkJ6+oPKL._SY88.jpg","https://m.media-amazon.com/images/I/61emPfCb6EL._SY88.jpg",,,,,,"Damage and defective phone","https://www.amazon.com/gp/customer-reviews/R21FHEV4PB4H6J","Reviewed in the United States on July 12, 2025","3876","349",,,"Service Provider: Unlocked, Color: Midnight, Size: 128GB","B0BN9426PP","Service Provider","Unlocked","Color","Midnight","Size","128GB"
"United States",,"2025-05-07",,"oneStar","https://www.amazon.com/Apple-iPhone-14-Plus-Midnight/dp/B0BN9426PP/ref=sr_1_1?crid=1YDRM1CHK0LR1&dib=eyJ2IjoiMSJ9.o040dRgi6iTkUgX7ekvlm_S9Z_UmAaS0TJCNsqYCOvmpWh6dZob506tswq3H0tXaBqMK1pISJwqJCKb5gNGLhEms4resbb0P_OxUbjAOlij-VbbqzubxAVToYB5LZN9R8pI_UoUlwta_J7a0J1iUV6R3XS6lJnt6C3Hu0FNnVeJDe2VZwaOWY1wz82MJgVxWYEmHGW1oh1nzID8pMP0HsMJH_BAra2_dmY_uUTBxTvI.j9lL6bMk35SY4qS6zGLqbGUPrHiH2552Fz8G1uiMBDw&dib_tag=se&keywords=iphone%2B14%2Bplus&qid=1752825828&sprefix=iphone%2B14%2Bplus%2Caps%2C667&sr=8-1&th=1","false","true","20",,,"B0BN9426PP","B0BN9426PP","1","https://www.amazon.com/product-reviews/B0BN9426PP?pageNumber=1&filterByStar=one_star&sortBy=helpful&formatType=all_formats&asin=B0BN9426PP&reftag=cm_cr_arp_d_paging_btm_next_1&scope=reviewsAjax0","Bought the phone and it came at 87% battery life which wasn't bad. The unfortunate part was when I went to connect the phone to my carrier it was blacklisted wasn't able to be connected. It was listed as reported stolen/lost. There was no way to connect it. The bright side was the refund process was easy and hassle free. Crazy for them to be selling phones in that condition considering an IMEI check is pretty easy. Totally avoidable situation.","R3C9QVK58MAB8F",,,,,,,,"Unfortunate experience","https://www.amazon.com/gp/customer-reviews/R3C9QVK58MAB8F","Reviewed in the United States on May 7, 2025","3876","349",,,"Service Provider: Unlocked, Color: Midnight, Size: 128GB","B0BN9426PP","Service Provider","Unlocked","Color","Midnight","Size","128GB"
